{
  "client": {
    "connection_pooling": "none",
    "streaming": true,
    "transport": "python_urllib"
  },
  "drain": {
    "policy": "complete_all"
  },
  "max_in_flight": 2,
  "measurement": {
    "requests": 4
  },
  "retry_policy": {
    "backoff_ms": 0,
    "max_attempts": 1,
    "retry_on": [
      "timeout",
      "http_429",
      "http_502",
      "http_503",
      "http_504"
    ]
  },
  "run_id": "llama-cpp-cpu-ac05-content-and-usage",
  "schema_version": "0.1",
  "seed": 20260831,
  "self_calibration": {
    "max_event_loop_lag_p99_ms": 20,
    "max_runner_process_cpu_percent_one_core": 10000,
    "max_runner_system_cpu_percent": 100,
    "max_schedule_lag_p99_ms": 20,
    "min_arrival_rate_ratio": 0.98,
    "min_closed_loop_concurrency_ratio": 0.6,
    "noise_stability_tolerance_ms": 20,
    "profile": "local_zero_delay_stream_v1",
    "repetitions": 2
  },
  "setup": {
    "endpoint_health": "none",
    "tokenizer_check": "none"
  },
  "timeout_s": 60,
  "token_accounting": {
    "authority": "server_usage"
  },
  "validator": {
    "mode": "none"
  },
  "warmup": {
    "requests": 1
  }
}
